{
  "version": 1,
  "id": "9b28efc6-cdc2-4c21-833a-d5900c29b010",
  "name": "完整求职资料模板",
  "revision": 0,
  "updatedAt": "2026-09-23T05:43:00.644Z",
  "modules": [
    {
      "id": "fee2ae51-7baf-4357-9a51-1e816475b332",
      "name": "基本信息",
      "tier": "常用",
      "templateKey": "basic",
      "entries": [
        {
          "id": "82c0e91a-0ea2-47fd-8317-a278dd769395",
          "title": "个人资料",
          "fields": [
            {
              "id": "876a3c99-4cfd-4d5e-911d-09833dd853f9",
              "label": "姓名",
              "group": "常用资料",
              "type": "text",
              "value": "",
              "sensitive": false
            },
            {
              "id": "47673023-7c01-4017-bca1-52a40d06e923",
              "label": "英文名",
              "group": "常用资料",
              "type": "text",
              "value": "",
              "sensitive": false
            },
            {
              "id": "73dbb869-54ee-45fa-a74f-0e374bfd5044",
              "label": "性别",
              "group": "常用资料",
              "type": "text",
              "value": "",
              "sensitive": false
            },
            {
              "id": "204a0ba1-97ce-4712-9b53-07e66970d12c",
              "label": "手机号码",
              "group": "常用资料",
              "type": "tel",
              "value": "",
              "sensitive": false
            },
            {
              "id": "b251c6ac-fb23-47cb-bacf-b8d25e4c5d2f",
              "label": "电子邮箱",
              "group": "常用资料",
              "type": "email",
              "value": "",
              "sensitive": false
            },
            {
              "id": "043a5f34-04db-4c04-a9fa-85a594f35c76",
              "label": "当前所在城市",
              "group": "常用资料",
              "type": "text",
              "value": "",
              "sensitive": false
            },
            {
              "id": "87f8c78f-ec55-4781-9c9b-f84cb55e5c61",
              "label": "个人网站",
              "group": "常用资料",
              "type": "url",
              "value": "",
              "sensitive": false
            },
            {
              "id": "8f83cb49-c5ee-4cb9-82be-82753230d701",
              "label": "作品集链接",
              "group": "常用资料",
              "type": "url",
              "value": "",
              "sensitive": false
            },
            {
              "id": "60031c0e-5efa-407a-945e-885a3157ca2c",
              "label": "出生日期",
              "group": "证件与个人状态",
              "type": "date",
              "value": "",
              "sensitive": true
            },
            {
              "id": "5a60fc4d-8d06-4d53-b4b7-cd8f3d6eaa5f",
              "label": "国籍 / 地区",
              "group": "证件与个人状态",
              "type": "text",
              "value": "",
              "sensitive": false
            },
            {
              "id": "2ae9fc51-9e2f-4edf-80a8-7ed20215a702",
              "label": "民族",
              "group": "证件与个人状态",
              "type": "text",
              "value": "",
              "sensitive": false
            },
            {
              "id": "9e7d1bb8-8043-4c3f-9ebc-e5fa240ce96c",
              "label": "政治面貌",
              "group": "证件与个人状态",
              "type": "text",
              "value": "",
              "sensitive": false
            },
            {
              "id": "b0783809-541f-4865-8ac7-78b30412dc87",
              "label": "籍贯",
              "group": "证件与个人状态",
              "type": "text",
              "value": "",
              "sensitive": false
            },
            {
              "id": "b7715d91-1331-4682-9fc0-ce4826b6e547",
              "label": "户籍所在地",
              "group": "证件与个人状态",
              "type": "text",
              "value": "",
              "sensitive": false
            },
            {
              "id": "bc2b794f-b773-41c5-b9ef-b6a1841109e9",
              "label": "生源地",
              "group": "证件与个人状态",
              "type": "text",
              "value": "",
              "sensitive": false
            },
            {
              "id": "2347def3-e956-40de-a230-b805dec5d9e2",
              "label": "证件类型",
              "group": "证件与个人状态",
              "type": "text",
              "value": "",
              "sensitive": false
            },
            {
              "id": "8b8edc52-1c60-4d21-bcea-84b53db341b6",
              "label": "证件号码",
              "group": "证件与个人状态",
              "type": "text",
              "value": "",
              "sensitive": true
            },
            {
              "id": "5fc9c426-6016-40e0-a02b-f7a3a89b295e",
              "label": "婚姻状况",
              "group": "证件与个人状态",
              "type": "text",
              "value": "",
              "sensitive": true
            },
            {
              "id": "853a8e34-56d3-4fab-9416-aa98c1cd727e",
              "label": "通讯地址",
              "group": "地址与其他",
              "type": "multiline",
              "value": "",
              "sensitive": true
            },
            {
              "id": "ad99f53c-1a4b-4382-b87d-c5fe91334319",
              "label": "邮政编码",
              "group": "地址与其他",
              "type": "text",
              "value": "",
              "sensitive": false
            },
            {
              "id": "484f6bd0-a85a-42a8-98ec-d0c0fa233f1a",
              "label": "微信号",
              "group": "地址与其他",
              "type": "text",
              "value": "",
              "sensitive": false
            },
            {
              "id": "cc20bb6b-1526-4d47-81fb-0f54b3951b34",
              "label": "备用电话",
              "group": "地址与其他",
              "type": "tel",
              "value": "",
              "sensitive": false
            },
            {
              "id": "0c8e2b1c-d511-453c-8f4f-162c4264ac6b",
              "label": "个人照片文件名（仅备注）",
              "group": "地址与其他",
              "type": "text",
              "value": "",
              "sensitive": false
            },
            {
              "id": "36f855e9-dcf3-4b15-9762-9929315765c2",
              "label": "简历附件文件名（仅备注）",
              "group": "地址与其他",
              "type": "text",
              "value": "",
              "sensitive": false
            }
          ]
        }
      ]
    },
    {
      "id": "54a28cda-69ce-445a-a8ba-624db61bfd9b",
      "name": "求职意向",
      "tier": "常用",
      "templateKey": "intention",
      "entries": [
        {
          "id": "b99ce6da-f547-491e-bec7-941b89282911",
          "title": "本次求职",
          "fields": [
            {
              "id": "b5eec46c-014f-4798-8d53-93237833a7cb",
              "label": "目标岗位",
              "group": "申请偏好",
              "type": "text",
              "value": "",
              "sensitive": false
            },
            {
              "id": "62376116-c016-4615-a28f-3211f4d03e40",
              "label": "目标职类",
              "group": "申请偏好",
              "type": "text",
              "value": "",
              "sensitive": false
            },
            {
              "id": "927a45cc-fe1d-40f9-99eb-6ebd063980a6",
              "label": "意向行业",
              "group": "申请偏好",
              "type": "text",
              "value": "",
              "sensitive": false
            },
            {
              "id": "8311f464-0de5-4fbe-a117-c34420b86243",
              "label": "意向公司",
              "group": "申请偏好",
              "type": "text",
              "value": "",
              "sensitive": false
            },
            {
              "id": "acb64b56-4eb3-4bc1-a8d2-9c9d945acf4f",
              "label": "意向城市",
              "group": "申请偏好",
              "type": "text",
              "value": "",
              "sensitive": false
            },
            {
              "id": "5b82d60c-1ed0-40f0-b0e6-294e72e4c014",
              "label": "求职类型（校招 / 社招 / 实习）",
              "group": "申请偏好",
              "type": "text",
              "value": "",
              "sensitive": false
            },
            {
              "id": "e487dd53-2727-4bfb-9b05-06d53507508b",
              "label": "工作方式（现场 / 混合 / 远程）",
              "group": "申请偏好",
              "type": "text",
              "value": "",
              "sensitive": false
            },
            {
              "id": "fcc9e389-4ea3-48b2-9484-cecc2f71561c",
              "label": "最早到岗日期",
              "group": "到岗安排",
              "type": "date",
              "value": "",
              "sensitive": false
            },
            {
              "id": "2da46956-09a9-4d1c-bf10-639c73dc349c",
              "label": "每周可实习天数",
              "group": "到岗安排",
              "type": "text",
              "value": "",
              "sensitive": false
            },
            {
              "id": "35818336-8edb-4184-b23e-30eb46ff00a8",
              "label": "可实习月数",
              "group": "到岗安排",
              "type": "text",
              "value": "",
              "sensitive": false
            },
            {
              "id": "a721efe1-4d79-4dc9-9cb8-01c7af57c786",
              "label": "预计毕业时间",
              "group": "到岗安排",
              "type": "text",
              "value": "",
              "sensitive": false
            },
            {
              "id": "df21df46-44c1-4321-bd03-97ee8901ae0b",
              "label": "期望薪资",
              "group": "到岗安排",
              "type": "text",
              "value": "",
              "sensitive": true
            },
            {
              "id": "bdfb5714-5e4c-4105-952a-db102b945b19",
              "label": "是否接受调剂",
              "group": "到岗安排",
              "type": "text",
              "value": "",
              "sensitive": false
            },
            {
              "id": "84b0a87e-f595-40d4-93ac-68c3cfee70b7",
              "label": "是否接受出差",
              "group": "到岗安排",
              "type": "text",
              "value": "",
              "sensitive": false
            },
            {